comment_id,text
1,"The plan is clearly structured with achievable milestones, and the team communicates updates promptly."
2,"Section 4 provides excellent clarity, making the compliance approach easy to understand and follow."
3,"Stakeholders appreciated the realistic timeline and the thoughtful risk mitigation strategies."
4,"The project team is highly responsive, incorporating feedback quickly and professionally."
5,"Vendor onboarding steps are well documented, reducing confusion and accelerating setup."
6,"The proposed training plan is practical and empowers users to adopt the solution confidently."
7,"Budget planning is transparent, and cost controls are sensible for long-term sustainability."
8,"Data privacy and retention policies are explained thoroughly, inspiring confidence in governance."
9,"Phased delivery reduces risk while delivering value early to stakeholders."
10,"Change control is clear, helping everyone stay aligned as the scope evolves."
11,"Testing windows are realistic and support high-quality releases with minimal disruption."
12,"The team demonstrates strong ownership and collaboration across departments."
13,"Documentation is concise, accurate, and easy to navigate for new contributors."
14,"Dependencies and assumptions are stated clearly, enabling better planning and coordination."
15,"The rollout plan balances speed and safety, which stakeholders found reassuring."
16,"Communication is timely, transparent, and solution-focused during every checkpoint."
17,"The compliance narrative is evidence-based and maps cleanly to regulatory controls."
18,"The risk register is well maintained and reviewed, showing proactive management."
19,"Accessibility requirements are considered thoughtfully, improving the experience for all users."
20,"The team handles complex questions with patience and detailed, actionable answers."
21,"Section 5 outlines escalation paths clearly, which helps maintain accountability."
22,"Procurement guidance is straightforward, reducing the time to contract and onboard vendors."
23,"Stakeholders felt their feedback was heard and reflected in the updated plan."
24,"The project dashboard surfaces metrics that make status easy to grasp at a glance."
25,"Security controls are pragmatic and align with corporate standards without adding friction."
26,"The integration approach is modular, supporting future enhancements with minimal rework."
27,"User acceptance criteria are clear and measurable, supporting smooth sign-offs."
28,"The training materials are polished, with relevant examples and hands-on exercises."
29,"Pilot scope is smartly defined to validate value quickly before scaling."
30,"Section 7’s testing approach is comprehensive and easy for teams to execute."
31,"Roles and responsibilities are clearly assigned, eliminating ambiguity."
32,"The communication plan includes the right stakeholders at the right cadence."
33,"Timeline buffers are realistic and grounded in historical delivery data."
34,"The solution design is well-architected and follows best practices."
35,"Budget assumptions are conservative and supported by clear rationale."
36,"The change management plan prioritizes user readiness and measurable adoption."
37,"Issue triage is fast, and resolutions are documented for future reference."
38,"The backlog is prioritized effectively, focusing on high-impact features first."
39,"Data migration steps are validated, reducing risk to business operations."
40,"The cutover checklist is thorough and rehearsed, increasing launch confidence."
41,"Stakeholder workshops were constructive and resulted in clear, shared outcomes."
42,"Section 2’s vendor criteria are fair, consistent, and easy to evaluate."
43,"The rollout strategy includes meaningful success metrics to track real outcomes."
44,"Support processes are defined, with SLAs that match business expectations."
45,"The governance model is simple to follow and supports timely decisions."
46,"Team morale is high, and collaboration tools are used effectively."
47,"The roadmap is ambitious yet attainable, with thoughtful sequencing."
48,"The solution’s scalability plan positions us well for future growth."
49,"Stakeholders praised the clarity of the executive summary and objectives."
50,"Overall, the project demonstrates strong leadership, clear value, and steady progress."
